{
  "decisionId": "decision:soften-request-otesuu",
  "decision": "merge-into-reviewed-family",
  "familyId": "expression:soften-request-otesuu",
  "mergedCandidates": [
    "candidate:jmdict:2830449"
  ],
  "relatedCandidatesNotMerged": [],
  "reviewedAt": "2026-09-30T09:15:00Z",
  "reviewer": "Arena.ai Koto Japanese editorial review",
  "reviewerType": "ai-editorial",
  "finalPublicationApproved": true
}
