{
  "decisionId": "decision:formal-setting-in",
  "decision": "merge-into-reviewed-family",
  "familyId": "expression:formal-setting-in",
  "mergedCandidates": [
    "candidate:jmdict:1009550",
    "candidate:jmdict:1009560"
  ],
  "relatedCandidatesNotMerged": [],
  "reviewedAt": "2026-09-30T19:30:00Z",
  "reviewer": "Arena.ai Koto Japanese editorial review",
  "reviewerType": "ai-editorial",
  "finalPublicationApproved": true
}
