{
  "decisionId": "decision:sum-up-in-short",
  "decision": "merge-into-reviewed-family",
  "familyId": "expression:sum-up-in-short",
  "mergedCandidates": [
    "candidate:jmdict:1546620"
  ],
  "relatedCandidatesNotMerged": [],
  "reviewedAt": "2026-09-30T16:30:00Z",
  "reviewer": "Arena.ai Koto Japanese editorial review",
  "reviewerType": "ai-editorial",
  "finalPublicationApproved": true
}
