{
  "decisionId": "decision:apologize-or-get-attention",
  "decision": "merge-into-reviewed-family",
  "familyId": "expression:apologize-or-get-attention",
  "mergedCandidates": [
    "candidate:jmdict:1295060",
    "candidate:jmdict:1270680",
    "candidate:jmdict:1612030"
  ],
  "relatedCandidatesNotMerged": [],
  "reviewedAt": "2026-09-30T07:15:00Z",
  "reviewer": "Arena.ai Koto Japanese editorial review",
  "reviewerType": "ai-editorial",
  "finalPublicationApproved": true
}
