{
  "decisionId": "decision:hit-a-sore-point",
  "decision": "merge-into-reviewed-family",
  "familyId": "expression:hit-a-sore-point",
  "mergedCandidates": [
    "candidate:jmdict:2836058"
  ],
  "relatedCandidatesNotMerged": [],
  "reviewedAt": "2026-09-30T19:30:00Z",
  "reviewer": "Arena.ai Koto Japanese editorial review",
  "reviewerType": "ai-editorial",
  "finalPublicationApproved": true
}
