{
  "decisionId": "decision:still-unchanged",
  "decision": "merge-into-reviewed-family",
  "familyId": "expression:still-unchanged",
  "mergedCandidates": [
    "candidate:jmdict:1155660"
  ],
  "relatedCandidatesNotMerged": [],
  "reviewedAt": "2026-09-30T16:30:00Z",
  "reviewer": "Arena.ai Koto Japanese editorial review",
  "reviewerType": "ai-editorial",
  "finalPublicationApproved": true
}
