{
  "decisionId": "decision:no-matter-how-long",
  "decision": "merge-into-reviewed-family",
  "familyId": "expression:no-matter-how-long",
  "mergedCandidates": [
    "candidate:jmdict:2086410"
  ],
  "relatedCandidatesNotMerged": [],
  "reviewedAt": "2026-09-30T19:30:00Z",
  "reviewer": "Arena.ai Koto Japanese editorial review",
  "reviewerType": "ai-editorial",
  "finalPublicationApproved": true
}
